{
  "product_or_offer": "frozen mixed vegetables",
  "target_market": "Poland",
  "customer_type": "importer",
  "search_keywords": [
    "frozen food importer",
    "private label frozen vegetables"
  ],
  "must_include": [
    "retail"
  ],
  "exclude_terms": [
    "job",
    "recruitment"
  ],
  "max_results": 4,
  "notes": "Prefer companies that look ready for private-label frozen food sourcing."
}
