{
  "product_or_offer": "washed linen table textile",
  "target_market": "Germany",
  "customer_type": "brand",
  "search_keywords": [
    "table linen brand",
    "home textile collections"
  ],
  "must_include": [
    "design"
  ],
  "exclude_terms": [
    "job",
    "salary"
  ],
  "max_results": 4,
  "notes": "Prefer companies with brand positioning and visible product presentation."
}
